{
  "$schema": "https://json-schema.org/draft/2020-12/schema",
  "title": "Per-chain context overrides",
  "description": "Optional. A strategy's chain.context selects the vendored ipor-abi snapshot contexts/ipor-abi/mainnet-<context>.json, which supplies every IPOR contract address (deploy/context.py). This file holds only what cannot be derived from ipor-abi or the FuseWhitelist.",
  "type": "object",
  "additionalProperties": false,
  "$defs": {
    "address": {"type": "string", "pattern": "^0x[a-fA-F0-9]{40}$"},
    "iporAbiKey": {"type": "string", "pattern": "^[A-Za-z][A-Za-z0-9_]*$"}
  },
  "properties": {
    "$schema": {"type": "string"},
    "chain_id": {"description": "Only for tools run without a strategy, when the context name is not in deploy/context.py CHAIN_IDS.", "type": "integer"},
    "ipor_abi_deployment": {"description": "Only when the ipor-abi folder is not mainnet-<context name>.", "type": "string"},
    "public_rpc": {
      "description": "Read-only public endpoint for dry-runs when RPC_URL is unset; never used for --broadcast.",
      "type": ["string", "null"]
    },
    "contracts": {
      "description": "Override a root contract's ipor-abi key (fusion_factory, price_oracle_middleware, fuse_whitelist, middleware_owner, morpho_blue) when this chain differs from the defaults.",
      "type": "object",
      "additionalProperties": {"$ref": "#/$defs/iporAbiKey"}
    },
    "standard_fuses": {
      "description": "Override the factory-injected fuses (ipor-abi keys, oldest first) when this chain differs from BurnRequestFeeFuse, BurnRequestFeeFuseV2.",
      "type": "array",
      "items": {"$ref": "#/$defs/iporAbiKey"}
    },
    "aliases": {
      "description": "A name strategies use -> the ipor-abi key it means, when they differ on this chain.",
      "type": "object",
      "additionalProperties": {"$ref": "#/$defs/iporAbiKey"}
    },
    "pins": {
      "description": "A fuse or pre-hook pinned to one address over the registries. Re-validated on every run: a pinned fuse must still be active on the FuseWhitelist.",
      "type": "object",
      "additionalProperties": {
        "type": "object",
        "required": ["address", "reason", "checked"],
        "additionalProperties": false,
        "properties": {
          "address": {"$ref": "#/$defs/address"},
          "reason": {"type": "string", "minLength": 10},
          "checked": {"type": "string", "pattern": "^\\d{4}-\\d{2}-\\d{2}$"},
          "revisit": {"type": "string"}
        }
      }
    },
    "external_addresses": {
      "description": "Third-party contracts ipor-abi does not list (e.g. the Aave V3 pool), with where the address comes from.",
      "type": "object",
      "additionalProperties": {
        "type": "object",
        "required": ["address", "source"],
        "additionalProperties": false,
        "properties": {"address": {"$ref": "#/$defs/address"}, "source": {"type": "string"}}
      }
    },
    "markets": {
      "description": "Market name -> id, only for ids the SDK's IporFusionMarkets does not know.",
      "type": "object",
      "additionalProperties": {"type": "integer"}
    },
    "tokens": {
      "description": "Token symbol -> address (third-party ERC20s) for names a strategy uses; the address report checks symbol() on-chain.",
      "type": "object",
      "additionalProperties": {"$ref": "#/$defs/address"}
    },
    "fuse_whitelist_gate": {
      "description": "Opt-out of the FuseWhitelist gate for a chain whose whitelist is not populated yet. Fuses then come from ipor-abi or pins; step 02 checks that each has code and verification downgrades the whitelist check to a warning.",
      "type": "object",
      "additionalProperties": false,
      "required": ["skip", "reason", "checked"],
      "properties": {
        "skip": {"type": "boolean"},
        "reason": {"type": "string", "minLength": 10},
        "checked": {"type": "string"}
      }
    }
  }
}
