{
  "$schema": "../schema/deploy-context.schema.json",
  "public_rpc": "https://rpc.hyperliquid.xyz/evm",
  "tokens": {
    "USDC": "0xb88339CB7199b77E23DB6E890353E22632Ba630f",
    "USDT0": "0xB8CE59FC3717ada4C02eaDF9682A9e934F625ebb",
    "WHYPE": "0x5555555555555555555555555555555555555555"
  },
  "markets": {
    "HYPERCORE": 55,
    "CROSSCHAIN": 54
  },
  "external_addresses": {
    "CcipRouter": {
      "address": "0x13b3332b66389B1467CA6eBd6fa79775CCeF65ec",
      "source": "CCIP_ROUTER() of the CcipCrosschainFactory on this chain, read 2026-10-23; matches the Chainlink CCIP directory"
    }
  }
}
