{
  "$schema": "../schema/deploy-context.schema.json",
  "public_rpc": "https://arb1.arbitrum.io/rpc",
  "pins": {
    "SupplyFuseErc4626Market1": {
      "address": "0xe7d3a550F0aD32cCBEF570C670b5ac004C276f24",
      "reason": "Same contract as Erc4626SupplyFuse above (ERC4626_0001); keep the version the SDK can encode",
      "checked": "2026-10-05",
      "revisit": "ipor-fusion.py can encode minShares for the 0xC0C2…E845 version"
    },
    "Erc4626SupplyFuse": {
      "address": "0xe7d3a550F0aD32cCBEF570C670b5ac004C276f24",
      "reason": "Two Erc4626SupplyFuse are active on the whitelist for ERC4626 markets; ipor-abi lists the newer 0xC0C2…E845, which needs minShares and the SDK cannot encode it yet",
      "checked": "2026-10-05",
      "revisit": "ipor-fusion.py can encode minShares for the 0xC0C2…E845 version"
    }
  },
  "tokens": {
    "USDC": "0xaf88d065e77c8cC2239327C5EDb3A432268e5831",
    "WETH": "0x82aF49447D8a07e3bd95BD0d56f35241523fBab1",
    "USDT0": "0xFd086bC7CD5C481DCC9C85ebE478A1C0b69FCbb9",
    "USDG": "0x004B506865409877C9fA29bfb1ebA929984B9bbC",
    "EUL": "0x462cD9E0247b2e63831c3189aE738E5E9a5a4b64"
  },
  "external_addresses": {
    "CcipRouter": {
      "address": "0x141fa059441E0ca23ce184B6A78bafD2A517DdE8",
      "source": "CCIP_ROUTER() of the CcipCrosschainFactory on this chain, read 2026-10-23; matches the Chainlink CCIP directory"
    }
  },
  "markets": {
    "CROSSCHAIN": 54
  }
}
